{
  "$schema": "../schema/sections.schema.json",
  "version": "1.0.0-rc.1",
  "$comment": "The vocabulary both implementations rename to (SC-001). Ids are canonical; each platform's former names and stored option values are mapped under platforms.<platform>.formerly, so its migration can be generated. Variants listed here are the selects that change a section's layout, and the styles a parent picks for a component, which has no fields file; every other field is in contract/fields. Visitor output and editor fields must match (SC-003). Drafted 08/10/2026 from inventories of salt-nextjs 0.11.0 and salt-wordpress 5.0.0.",
  "sections": [
    {
      "id": "hero",
      "label": "Hero",
      "tier": "core",
      "summary": "The page's opening band: eyebrow, heading, subheading, up to the contract's limit of buttons, and an image.",
      "variants": [
        {
          "field": "variant",
          "label": "Layout",
          "options": [
            {
              "value": "full-bleed",
              "label": "Full bleed"
            },
            {
              "value": "split",
              "label": "Split"
            },
            {
              "value": "stacked",
              "label": "Stacked"
            },
            {
              "value": "minimal",
              "label": "Minimal (text only)"
            }
          ],
          "default": "full-bleed"
        }
      ],
      "platforms": {
        "nextjs": {
          "status": "ships",
          "formerly": [
            {
              "name": "hero",
              "values": {
                "variant": {
                  "fullBleed": "full-bleed",
                  "split": "split",
                  "stacked": "stacked",
                  "minimal": "minimal"
                }
              }
            }
          ]
        },
        "wordpress": {
          "status": "partial",
          "formerly": [
            {
              "name": "hero"
            }
          ],
          "owes": "the stacked variant"
        }
      }
    },
    {
      "id": "rich-text",
      "label": "Rich text",
      "tier": "core",
      "summary": "Eyebrow, heading and a rich-text body, aligned left or centred.",
      "variants": [
        {
          "field": "alignment",
          "label": "Alignment",
          "options": [
            {
              "value": "left",
              "label": "Left"
            },
            {
              "value": "centre",
              "label": "Centred"
            }
          ],
          "default": "left"
        }
      ],
      "platforms": {
        "nextjs": {
          "status": "ships",
          "formerly": [
            {
              "name": "richText"
            }
          ]
        },
        "wordpress": {
          "status": "ships",
          "formerly": [
            {
              "name": "rich_text"
            },
            {
              "name": "intro",
              "note": "Eyebrow, heading, content and align: the same fields as rich-text, so intro folds into it."
            }
          ]
        }
      }
    },
    {
      "id": "call-to-action",
      "label": "Call to action",
      "tier": "core",
      "summary": "A heading, a short body and buttons, on a contrasting band.",
      "platforms": {
        "nextjs": {
          "status": "ships",
          "formerly": [
            {
              "name": "cta"
            }
          ]
        },
        "wordpress": {
          "status": "ships",
          "formerly": [
            {
              "name": "cta"
            }
          ]
        }
      }
    },
    {
      "id": "media-text",
      "label": "Media and text",
      "tier": "core",
      "summary": "Rows of an image beside text, each row on a chosen side or alternating.",
      "variants": [
        {
          "field": "mode",
          "label": "Mode",
          "options": [
            {
              "value": "single",
              "label": "One layout for every row"
            },
            {
              "value": "alternating",
              "label": "Alternate the sides automatically"
            }
          ],
          "default": "single"
        }
      ],
      "platforms": {
        "nextjs": {
          "status": "ships",
          "formerly": [
            {
              "name": "mediaText"
            }
          ]
        },
        "wordpress": {
          "status": "ships",
          "formerly": [
            {
              "name": "media_text"
            }
          ]
        }
      }
    },
    {
      "id": "features",
      "label": "Features",
      "tier": "core",
      "summary": "A grid of items, each an icon, a title and a short description.",
      "platforms": {
        "nextjs": {
          "status": "ships",
          "formerly": [
            {
              "name": "features"
            }
          ]
        },
        "wordpress": {
          "status": "ships",
          "formerly": [
            {
              "name": "features"
            }
          ]
        }
      }
    },
    {
      "id": "stats",
      "label": "Stats",
      "tier": "core",
      "summary": "A row of figures with labels.",
      "platforms": {
        "nextjs": {
          "status": "ships",
          "formerly": [
            {
              "name": "stats"
            }
          ]
        },
        "wordpress": {
          "status": "ships",
          "formerly": [
            {
              "name": "stats"
            }
          ]
        }
      }
    },
    {
      "id": "logos",
      "label": "Logos",
      "tier": "core",
      "summary": "A strip of client or partner logos, optionally in greyscale.",
      "platforms": {
        "nextjs": {
          "status": "ships",
          "formerly": [
            {
              "name": "logos"
            }
          ]
        },
        "wordpress": {
          "status": "ships",
          "formerly": [
            {
              "name": "logos"
            }
          ]
        }
      }
    },
    {
      "id": "gallery",
      "label": "Gallery",
      "tier": "core",
      "summary": "A set of images in a grid, a masonry layout or a carousel.",
      "variants": [
        {
          "field": "layout",
          "label": "Layout",
          "options": [
            {
              "value": "grid",
              "label": "Grid"
            },
            {
              "value": "masonry",
              "label": "Masonry"
            },
            {
              "value": "carousel",
              "label": "Carousel"
            }
          ],
          "default": "grid"
        }
      ],
      "platforms": {
        "nextjs": {
          "status": "ships",
          "formerly": [
            {
              "name": "gallery"
            }
          ]
        },
        "wordpress": {
          "status": "ships",
          "formerly": [
            {
              "name": "gallery"
            }
          ]
        }
      }
    },
    {
      "id": "process",
      "label": "Process",
      "tier": "core",
      "summary": "Ordered steps, as a timeline or as cards.",
      "variants": [
        {
          "field": "layout",
          "label": "Layout",
          "options": [
            {
              "value": "timeline",
              "label": "Timeline"
            },
            {
              "value": "cards",
              "label": "Cards"
            }
          ],
          "default": "timeline"
        }
      ],
      "platforms": {
        "nextjs": {
          "status": "ships",
          "formerly": [
            {
              "name": "process"
            }
          ]
        },
        "wordpress": {
          "status": "ships",
          "formerly": [
            {
              "name": "process"
            }
          ]
        }
      }
    },
    {
      "id": "faq",
      "label": "Frequently asked questions",
      "tier": "core",
      "summary": "Questions and answers drawn from the FAQ collection, as an accordion, with optional FAQPage structured data.",
      "sources": [
        {
          "id": "faqs",
          "label": "FAQs",
          "linked": false,
          "categories": true
        }
      ],
      "platforms": {
        "nextjs": {
          "status": "ships",
          "formerly": [
            {
              "name": "faq"
            }
          ]
        },
        "wordpress": {
          "status": "ships",
          "formerly": [
            {
              "name": "faq"
            }
          ]
        }
      }
    },
    {
      "id": "tabs",
      "label": "Tabs",
      "tier": "core",
      "summary": "Content panels behind an accessible tab set.",
      "platforms": {
        "nextjs": {
          "status": "ships",
          "formerly": [
            {
              "name": "tabs"
            }
          ]
        },
        "wordpress": {
          "status": "owes",
          "owes": "the section"
        }
      }
    },
    {
      "id": "collection-showcase",
      "label": "Collection showcase",
      "tier": "core",
      "summary": "Items from one collection as cards, in a grid, a list, a featured layout, an accordion or an index.",
      "variants": [
        {
          "field": "layout",
          "label": "Layout",
          "options": [
            {
              "value": "grid",
              "label": "Grid"
            },
            {
              "value": "list",
              "label": "List"
            },
            {
              "value": "featured",
              "label": "Featured (the first card leads)"
            },
            {
              "value": "accordion",
              "label": "Accordion (each title opens in place)"
            },
            {
              "value": "index",
              "label": "Index (a list of links)",
              "note": "Only for sources whose items have their own page."
            }
          ],
          "default": "grid"
        }
      ],